{"schema_version":"1","task_identity":"generate_scene_production_options","task_version":"1","request_id":"m4-3-request-001","correlation_id":"m4-3-local-run","project_id":"movie-local","environment":"development","purpose":"scene_production_options_local_validation","expected_context_family":"scene_production_options_context","expected_context_version":"1","expected_result_family":"scene_production_option_set","expected_result_version":"1","scene_breakdown_identity":"scene_breakdown","scene_breakdown_version":"1","scene_breakdown_digest":"53c33b607026ca04dd41db92c1096afeeae906ec2139831ae9d7c3cdced159a3","scene_id":"scene-fragment-opening-001-1","scene_content_digest":"9e192196961ba971003041c75e899c6eac13db1554d2c7ab0ffbaa7c1b345da3","classification":"public","trust":"approved_fixture","bounds":{"maximum_options":4,"maximum_result_bytes":65536,"maximum_duration_ms":30000},"lifecycle":"active","implementation_availability":"required"}
